{
  "record_version": 1,
  "suite_version": "1.0.0",
  "scenario_id": "S1",
  "repetition": 1,
  "status": "NOT_RUN",
  "evidence_level": "NONE",
  "metadata": {
    "project_commit": null,
    "hermes_commit": null,
    "model": null,
    "provider": null,
    "skill_sha256": null,
    "skill_activation": "NOT_RECORDED",
    "context_condition": "UNRECORDED",
    "mcp_tools_schema_sha256": null,
    "non_sensitive_config": {},
    "context_evidence_refs": []
  },
  "started_at": null,
  "finished_at": null,
  "turns": [],
  "tool_calls": [],
  "artifact_evidence": [],
  "human_checks": [],
  "reviewer": null,
  "notes": [
    "Template only. No conversation has been executed. Never infer writes from an agent summary."
  ]
}
